{
  "number": 1,
  "sanskrit": "Tāḍāsana",
  "english": "Mountain",
  "house": "House of the Rooted Axis",
  "element": "Earth",
  "color": "ochre",
  "bija": "LAM",
  "house_intensity": 1,
  "breath_demand": 1,
  "requires_lotus": false,
  "status": "researched",
  "pairing_type": "school_device",
  "lineage": "Vijnana Bhairava Tantra. The asana–verse pairing on this door is a School of 112 Doorways device (school_device), not a claim of ancient one-to-one canon.",
  "geometry": {
    "polygon": "isosceles triangle",
    "vertices": [
      [0, 0],
      [2, 0],
      [1, 3.2]
    ],
    "units": "Frontal plane, in body-widths. The base is the two feet. The apex is the crown. A sketch of the mountain, not a measurement to match."
  },
  "reaction": {
    "reactants": [
      "weight dumped into one hip",
      "a gaze that hunts for something to do"
    ],
    "catalyst": "even contact of both soles with the ground",
    "product": "unforced vertical quiet",
    "phase": "solidification",
    "note": "Alchemical teaching metaphor. Nothing is mixed, swallowed, or applied."
  },
  "breath": {
    "inhale": 4,
    "exhale": 4,
    "pause": 2,
    "pause_after": "exhale",
    "bandha": "None. The feet are the root. Do not grip the jaw, the belly, or the pelvic floor to feel established.",
    "units": "Equal counts. One count is a comfortable pulse, not a clock second. The pause is a quiet suspension after the exhale, released the moment it becomes a grip."
  },
  "orientation": {
    "hand_placement": "Arms hang beside the ribs, palms turned toward the thighs, fingers soft and awake.",
    "gaze": "The horizon, eyes level. If the horizon swims or darkens, lower the gaze to the floor a short distance ahead and shorten the stay.",
    "joint_lead": "The mounds of the big toes and the outer heels. Knees follow without locking. Hips stack over the ankles. The crown is last, and it does not reach."
  },
  "attention": {
    "locus": "the inner line from the center of both soles to the crown",
    "chakra": "mūlādhāra, as ground rather than as a place to strain"
  },
  "adiyogi_method": {
    "vbt_verse": 24,
    "yukti": 1,
    "extreme": false,
    "practice_mode": "practice",
    "summary": "Teaching reference, not a claim that Mountain is the verse. Vijnana Bhairava Tantra verse 24 is the first of the 112 dharanas in the usual counting: attention at the two junctions where the breath turns, until those pauses feel full rather than empty. Here the mountain is that junction stood upright — a pause one inhabits and does not grip. Editions differ by a line or two; if a copy numbers the breath-junction a verse away, follow the junction, and say so."
  },
  "guardian": "Himavan — the mountain who does not announce himself",
  "safety_notes": [
    "Do not lock or thrust the knees backward. If the knees hyperextend, keep a whisper of softness and bring weight toward the heels and the mounds of the big toes.",
    "Dizziness, narrowing vision, or a sudden heat in the face is a stop. Lower the gaze, lengthen the exhale, and sit down if it does not pass. This is not a cleansing sign.",
    "Recent ankle sprain, acute knee pain, or an inner-ear balance disturbance: practice beside a wall, one hand available, not in the middle of the room.",
    "Low blood pressure, long illness, or heat: Mountain is still standing. Fatigue is information. Shorten the stay.",
    "Pregnancy: the pose is generally suitable. Widen the feet if a broader base is kinder, and do not hold a long time in heat."
  ],
  "five_ways": [
    "Show the pose twice in silence: once as a whole figure, once with attention only on the feet.",
    "Name three points and then stop talking: mounds of the big toes, knees that are not locked, crown without a lifted chin.",
    "Offer a wall behind the heels, or a block lightly between the thighs, when weight keeps escaping to one side.",
    "Lead four counts in and four counts out. Let the pause after the exhale appear. Do not hunt a longer one.",
    "If the student begins performing straightness, end the stay and ask them to feel the pause between two ordinary steps."
  ]
}
