{
  "number": 112,
  "sanskrit": "Padmāsana",
  "english": "Lotus",
  "house": "House of the Unstruck Seat",
  "element": "Ether",
  "color": "indigo",
  "bija": "OM",
  "house_intensity": 5,
  "breath_demand": 3,
  "requires_lotus": true,
  "status": "researched",
  "pairing_type": "school_device",
  "practice_mode": "observe_only",
  "lineage": "Vijnana Bhairava Tantra. The asana–verse pairing on this door is a School of 112 Doorways device (school_device), not a claim of ancient one-to-one canon. Lotus is an optional seat, not proof of mastery.",
  "alternate_geometry": {
    "polygon": "open seat",
    "seat": "Sukhāsana, or a chair",
    "vertices": [
      [-1.2, 0],
      [-0.5, 0.55],
      [0.5, 0.55],
      [1.2, 0]
    ],
    "units": "Horizontal sketch of an open seat. The knees fall only as far as they already do. This twin replaces the closed octagon whenever lotus would have to be forced."
  },
  "safety": {
    "bind": "never_force",
    "open_seat_twin": "Sukhāsana, or a chair",
    "override": "The safety layer overrides the closed lotus geometry. If a knee complains, the session is the open seat."
  },
  "geometry": {
    "polygon": "octagon",
    "vertices": [
      [0, -1],
      [0.707, -0.707],
      [1, 0],
      [0.707, 0.707],
      [0, 1],
      [-0.707, 0.707],
      [-1, 0],
      [-0.707, -0.707]
    ],
    "units": "Horizontal plane. Eight points of a regular octagon, a teaching figure for a many-petaled seat. Not a diagram of how far a knee must travel."
  },
  "reaction": {
    "reactants": [
      "legs that argue",
      "senses leaning outward"
    ],
    "catalyst": "hips that already know external rotation, and time",
    "product": "a seat that can be left as easily as it was taken",
    "phase": "dissolution",
    "note": "Metaphor only. If a knee speaks, there is no product to force. The reaction does not run."
  },
  "breath": {
    "inhale": 4,
    "exhale": 6,
    "pause": 2,
    "pause_after": "exhale",
    "bandha": "None in this teaching script. Mahā bandha is outside the door until a living teacher gives it in person. Do not add locks to make the seat feel real.",
    "units": "Equal counts. One count is a comfortable pulse, not a clock second. The pause after the exhale is mild and is dropped the moment the body asks for air."
  },
  "orientation": {
    "hand_placement": "Only if the legs have found the seat without force: hands rest on the knees, palms soft, thumb and index finger lightly joined. If the seat is not available, the same hands rest this way on the knees in a chair or in an easy cross-legged seat. The hand shape does not require lotus.",
    "gaze": "Eyes lowered, or gently closed. No fixed stare. If the eyes close and the mind spins, leave them softly open toward the floor.",
    "joint_lead": "The hips. The knees are followers. If a knee must be persuaded, the door is shut. Ankles are not handles."
  },
  "attention": {
    "locus": "the center of the chest, quieter than the shape of the legs",
    "chakra": "hṛdaya — the heart, not a performance at the crown"
  },
  "adiyogi_method": {
    "vbt_verse": 138,
    "yukti": 112,
    "extreme": true,
    "practice_mode": "observe_only",
    "summary": "Teaching reference, marked historical and observe_only: not a class drill, and no readiness flag promotes it into one. Verse 138 is yukti 112 in the usual counting of the Vijnana Bhairava Tantra, the last of the 112 brief instructions. It points toward a settling in which restless mind, breath-as-effort, the feeling of being a separate knower, and the self-image are no longer being held in place. This gloss is not a translation and not a technique for forcing that settling. Verse 49's heart-lotus is a cousin image; this door does not collapse the two into one claim. The pose is never the method."
  },
  "guardian": "Dakṣiṇāmūrti — the teacher who faces south and speaks by silence",
  "safety_notes": [
    "Never force Padmāsana. Knee cartilage does not negotiate. If either knee lifts high, complains, or the foot must be hauled into place, come out at once.",
    "Prior knee injury, knee surgery, ligament sprain, or pain under the kneecap: do not attempt lotus. A chair, or an easy seat in which both knees are comfortable, is the door for that day.",
    "Ankle sprain, Achilles pain, or hips that do not already externally rotate: same rule. The hips lead. The ankles are not levers.",
    "Hip replacement, or any limit a physician has set on hip rotation: stay inside that limit. This text is not a clearance to fold the leg.",
    "Pregnancy: lotus is optional and often uncomfortable. Leave for numbness, pubic pain, or breath that cannot deepen. Side-sitting or a bolster is enough.",
    "Sciatica or pain that travels down the leg: do not fold the legs into a shape that reproduces it.",
    "Numbness in a foot is a reason to leave immediately, not a sign of progress."
  ],
  "five_ways": [
    "Show the shape on a drawing, or on a teacher whose hips already have it. The student does not copy with the hands.",
    "Teach the same hands, gaze, and breath in a chair, and say plainly that the chair is an honest seat for today.",
    "If the student is close, one foot may rest on the opposite thigh only when that knee descends without being pressed. Full lotus is not the homework.",
    "Keep the breath in whatever seat is already available. If the breath shortens in order to win the shape, abandon the shape.",
    "Read verse 138 aloud as study. Do not ask the student to make mind, breath, knowing, or self-image dissolve. Close by feeling the feet, or the chair, ordinary and awake."
  ]
}
